{
  "generatedBy": "scripts/generate_schema_index.py",
  "schema": "edgp.schema.index.v1",
  "schemaCount": 35,
  "schemas": [
    {
      "contract": "edgp.advisory.report.v1",
      "description": "Local advisory overlay report with matched packages and reverse dependency impact.",
      "file": "edgp.advisory.report.v1.schema.json",
      "id": "urn:edgp:schema:advisory-report:v1",
      "jsonSchema": "https://json-schema.org/draft/2020-12/schema",
      "title": "EDGP Advisory Report v1"
    },
    {
      "contract": "edgp.albs.artifact_inventory.v1",
      "description": "ALBS build artifact inventory report derived from public build metadata.",
      "file": "edgp.albs.artifact_inventory.v1.schema.json",
      "id": "urn:edgp:schema:albs-artifact-inventory:v1",
      "jsonSchema": "https://json-schema.org/draft/2020-12/schema",
      "title": "EDGP ALBS Artifact Inventory v1"
    },
    {
      "contract": "edgp.albs.build_diff.v1",
      "description": "ALBS build comparison report for public build metadata.",
      "file": "edgp.albs.build_diff.v1.schema.json",
      "id": "urn:edgp:schema:albs-build-diff:v1",
      "jsonSchema": "https://json-schema.org/draft/2020-12/schema",
      "title": "EDGP ALBS Build Diff v1"
    },
    {
      "contract": "edgp.albs.build_timing.v1",
      "description": "ALBS build timing report for build tasks, sign tasks, and artifact processing.",
      "file": "edgp.albs.build_timing.v1.schema.json",
      "id": "urn:edgp:schema:albs-build-timing:v1",
      "jsonSchema": "https://json-schema.org/draft/2020-12/schema",
      "title": "EDGP ALBS Build Timing v1"
    },
    {
      "contract": "edgp.albs.log_intelligence.v1",
      "description": "ALBS build-log signal extraction report from public build metadata.",
      "file": "edgp.albs.log_intelligence.v1.schema.json",
      "id": "urn:edgp:schema:albs-log-intelligence:v1",
      "jsonSchema": "https://json-schema.org/draft/2020-12/schema",
      "title": "EDGP ALBS Log Intelligence v1"
    },
    {
      "contract": "edgp.albs.release_completeness.v1",
      "description": "ALBS release completeness report for public build batches.",
      "file": "edgp.albs.release_completeness.v1.schema.json",
      "id": "urn:edgp:schema:albs-release-completeness:v1",
      "jsonSchema": "https://json-schema.org/draft/2020-12/schema",
      "title": "EDGP ALBS Release Completeness v1"
    },
    {
      "contract": "edgp.bundle.catalog.v1",
      "description": "Catalog of verified EDGP static report bundles for batch CI and workbench ingestion.",
      "file": "edgp.bundle.catalog.v1.schema.json",
      "id": "urn:edgp:schema:bundle-catalog:v1",
      "jsonSchema": "https://json-schema.org/draft/2020-12/schema",
      "title": "EDGP Bundle Catalog v1"
    },
    {
      "contract": "edgp.csr.artifact.v1",
      "description": "Memory-mappable frozen CSR graph artifact manifest with array digests.",
      "file": "edgp.csr.artifact.v1.schema.json",
      "id": "urn:edgp:schema:csr-artifact:v1",
      "jsonSchema": "https://json-schema.org/draft/2020-12/schema",
      "title": "EDGP CSR Artifact Manifest v1"
    },
    {
      "contract": "edgp.export.batch.archive.v1",
      "description": "Archive report for deterministic graph export batch tar.gz handoff artifacts.",
      "file": "edgp.export.batch.archive.v1.schema.json",
      "id": "urn:edgp:schema:export-batch-archive:v1",
      "jsonSchema": "https://json-schema.org/draft/2020-12/schema",
      "title": "EDGP Export Batch Archive v1"
    },
    {
      "contract": "edgp.export.batch.submission_plan.v1",
      "description": "Dry-run submission plan for verified graph export batch artifacts.",
      "file": "edgp.export.batch.submission_plan.v1.schema.json",
      "id": "urn:edgp:schema:export-batch-submission-plan:v1",
      "jsonSchema": "https://json-schema.org/draft/2020-12/schema",
      "title": "EDGP Export Batch Submission Plan v1"
    },
    {
      "contract": "edgp.export.batch.v1",
      "description": "Local batch export manifest for graph egress artifacts written from an EDGP snapshot.",
      "file": "edgp.export.batch.v1.schema.json",
      "id": "urn:edgp:schema:export-batch:v1",
      "jsonSchema": "https://json-schema.org/draft/2020-12/schema",
      "title": "EDGP Export Batch v1"
    },
    {
      "contract": "edgp.export.batch.verification.v1",
      "description": "Verification report for local graph export batches and their artifact fingerprints.",
      "file": "edgp.export.batch.verification.v1.schema.json",
      "id": "urn:edgp:schema:export-batch-verification:v1",
      "jsonSchema": "https://json-schema.org/draft/2020-12/schema",
      "title": "EDGP Export Batch Verification v1"
    },
    {
      "contract": "edgp.graph.diff.v1",
      "description": "Graph snapshot diff report for two EDGP graph snapshot JSON documents.",
      "file": "edgp.graph.diff.v1.schema.json",
      "id": "urn:edgp:schema:graph-diff:v1",
      "jsonSchema": "https://json-schema.org/draft/2020-12/schema",
      "title": "EDGP Graph Diff v1"
    },
    {
      "contract": "edgp.graph.snapshot.v1",
      "description": "Deterministic EDGP graph snapshot exported from a CSR dependency graph.",
      "file": "edgp.graph.snapshot.v1.schema.json",
      "id": "urn:edgp:schema:graph-snapshot:v1",
      "jsonSchema": "https://json-schema.org/draft/2020-12/schema",
      "title": "EDGP Graph Snapshot v1"
    },
    {
      "contract": "edgp.impact.report.v1",
      "description": "Reverse dependency impact report for a selected graph node.",
      "file": "edgp.impact.report.v1.schema.json",
      "id": "urn:edgp:schema:impact-report:v1",
      "jsonSchema": "https://json-schema.org/draft/2020-12/schema",
      "title": "EDGP Impact Report v1"
    },
    {
      "contract": "edgp.libsolv.bridge.v1",
      "description": "libsolv command availability, normalized transaction, and optional graph match report.",
      "file": "edgp.libsolv.bridge.v1.schema.json",
      "id": "urn:edgp:schema:libsolv-bridge:v1",
      "jsonSchema": "https://json-schema.org/draft/2020-12/schema",
      "title": "EDGP libsolv Bridge v1"
    },
    {
      "contract": "edgp.license.report.v1",
      "description": "License inventory and deny-list policy report for graph metadata.",
      "file": "edgp.license.report.v1.schema.json",
      "id": "urn:edgp:schema:license-report:v1",
      "jsonSchema": "https://json-schema.org/draft/2020-12/schema",
      "title": "EDGP License Report v1"
    },
    {
      "contract": "edgp.npm.diagnostics.v1",
      "description": "npm package-lock diagnostics for duplicate names, nested version conflicts, and unresolved declarations.",
      "file": "edgp.npm.diagnostics.v1.schema.json",
      "id": "urn:edgp:schema:npm-diagnostics:v1",
      "jsonSchema": "https://json-schema.org/draft/2020-12/schema",
      "title": "EDGP npm Diagnostics v1"
    },
    {
      "contract": "edgp.parallel.query.report.v1",
      "description": "Parallel frozen-CSR reachability query report.",
      "file": "edgp.parallel.query.report.v1.schema.json",
      "id": "urn:edgp:schema:parallel-query-report:v1",
      "jsonSchema": "https://json-schema.org/draft/2020-12/schema",
      "title": "EDGP Parallel Query Report v1"
    },
    {
      "contract": "edgp.performance.report.v1",
      "description": "Synthetic CSR performance report for public validation environments.",
      "file": "edgp.performance.report.v1.schema.json",
      "id": "urn:edgp:schema:performance-report:v1",
      "jsonSchema": "https://json-schema.org/draft/2020-12/schema",
      "title": "EDGP Performance Report v1"
    },
    {
      "contract": "edgp.public.advisory_feed.v1",
      "description": "Normalized public advisory feed report with EDGP overlay output.",
      "file": "edgp.public.advisory_feed.v1.schema.json",
      "id": "urn:edgp:schema:public-advisory-feed:v1",
      "jsonSchema": "https://json-schema.org/draft/2020-12/schema",
      "title": "EDGP Public Advisory Feed v1"
    },
    {
      "contract": "edgp.query.report.v1",
      "description": "Graph traversal query report for EDGP dependency graph sources.",
      "file": "edgp.query.report.v1.schema.json",
      "id": "urn:edgp:schema:query-report:v1",
      "jsonSchema": "https://json-schema.org/draft/2020-12/schema",
      "title": "EDGP Query Report v1"
    },
    {
      "contract": "edgp.report.bundle.archive.v1",
      "description": "Archive report emitted by edgp archive-bundle or edgp verify-bundle-archive for deterministic EDGP static report bundle archives.",
      "file": "edgp.report.bundle.archive.v1.schema.json",
      "id": "urn:edgp:schema:report-bundle-archive:v1",
      "jsonSchema": "https://json-schema.org/draft/2020-12/schema",
      "title": "EDGP Report Bundle Archive v1"
    },
    {
      "contract": "edgp.report.bundle.submission_plan.v1",
      "description": "Dry-run submission plan for verified static report bundle artifacts.",
      "file": "edgp.report.bundle.submission_plan.v1.schema.json",
      "id": "urn:edgp:schema:report-bundle-submission-plan:v1",
      "jsonSchema": "https://json-schema.org/draft/2020-12/schema",
      "title": "EDGP Report Bundle Submission Plan v1"
    },
    {
      "contract": "edgp.report.bundle.v1",
      "description": "Manifest written beside EDGP static report bundle indexes.",
      "file": "edgp.report.bundle.v1.schema.json",
      "id": "urn:edgp:schema:report-bundle-manifest:v1",
      "jsonSchema": "https://json-schema.org/draft/2020-12/schema",
      "title": "EDGP Report Bundle Manifest v1"
    },
    {
      "contract": "edgp.report.bundle.verification.v1",
      "description": "Verification report emitted by edgp verify-bundle for EDGP static report bundles.",
      "file": "edgp.report.bundle.verification.v1.schema.json",
      "id": "urn:edgp:schema:report-bundle-verification:v1",
      "jsonSchema": "https://json-schema.org/draft/2020-12/schema",